,rid,sid,text,category,polarity,attribute,entity
1109,121,121:1,"I actually had the hard drive replaced twice, the mother board once, the dvd drive twice, then they FINALLY agreed to replace it, (ALL OF THIS IN LESS THAN 1 1/2 YEARS!)only to get another ""HP/Compaq"" piece of crap.",LAPTOP#QUALITY,negative,QUALITY,LAPTOP
1110,121,121:2,"It was slow, locked up, and also had hardware replaced after only 2 months!",LAPTOP#OPERATION_PERFORMANCE,negative,OPERATION_PERFORMANCE,LAPTOP
1111,121,121:2,"It was slow, locked up, and also had hardware replaced after only 2 months!",HARDWARE#QUALITY,negative,QUALITY,HARDWARE
1112,121,121:3,"So, buyers beware!",LAPTOP#GENERAL,negative,GENERAL,LAPTOP
1113,366,366:0,My husband got me this for Chrismas after getting me a very expensve laptop that did not work after 2 days.,UNKNOWN#UNKNOWN,UNKNOWN,UNKNOWN,UNKNOWN
1114,366,366:1,So we exchanged it for the same on and after 2 hours it didn't work.,UNKNOWN#UNKNOWN,UNKNOWN,UNKNOWN,UNKNOWN
1115,366,366:2,I went with him and we picked this one.,UNKNOWN#UNKNOWN,UNKNOWN,UNKNOWN,UNKNOWN
1116,366,366:3,"It is made better, thicker, and all out tough!",LAPTOP#QUALITY,positive,QUALITY,LAPTOP
1117,366,366:3,"It is made better, thicker, and all out tough!",LAPTOP#DESIGN_FEATURES,positive,DESIGN_FEATURES,LAPTOP
1118,366,366:4,I droped this once from thetable when my baby girl grabed me one day and IT is still working with NO issues!,LAPTOP#QUALITY,positive,QUALITY,LAPTOP
1119,366,366:5,"I love the easy to see screen, and It works well for work, persoal or just play.",DISPLAY#USABILITY,positive,USABILITY,DISPLAY
1120,366,366:5,"I love the easy to see screen, and It works well for work, persoal or just play.",LAPTOP#MISCELLANEOUS,positive,MISCELLANEOUS,LAPTOP
1121,366,366:6,I tell everyone I see out looking to get this or another Toshiba.,LAPTOP#GENERAL,positive,GENERAL,LAPTOP
1122,366,366:6,I tell everyone I see out looking to get this or another Toshiba.,COMPANY#GENERAL,positive,GENERAL,COMPANY
1123,366,366:7,"My dad has one of the very first Toshibas ever made, yes its abit slow now but still works well and i hooked to my ethernet!",UNKNOWN#UNKNOWN,UNKNOWN,UNKNOWN,UNKNOWN
1124,366,366:8,My friends or children use that when they need to borrow the Net =) When I out grow this Meaning when its old and my oldest child is ready for one she will get this one ANd I will be buying only TOSHIBA!,COMPANY#GENERAL,positive,GENERAL,COMPANY
1125,366,366:9,"I just love this lap top, I just wish it were all silver or they had all black.",LAPTOP#GENERAL,positive,GENERAL,LAPTOP
1126,366,366:9,"I just love this lap top, I just wish it were all silver or they had all black.",LAPTOP#DESIGN_FEATURES,neutral,DESIGN_FEATURES,LAPTOP
1127,366,366:10,That is my only complaint!,LAPTOP#DESIGN_FEATURES,negative,DESIGN_FEATURES,LAPTOP
1128,366,366:11,LOVE THIS LAPTOP WONDERFUL PRICE FOR WHAT YOU GET!,LAPTOP#GENERAL,positive,GENERAL,LAPTOP
1129,366,366:11,LOVE THIS LAPTOP WONDERFUL PRICE FOR WHAT YOU GET!,LAPTOP#PRICE,positive,PRICE,LAPTOP
1130,366,366:12,WOULD PAY MORE FOR IT IF I HAD TOO!,LAPTOP#GENERAL,positive,GENERAL,LAPTOP
1131,366,366:12,WOULD PAY MORE FOR IT IF I HAD TOO!,LAPTOP#PRICE,positive,PRICE,LAPTOP
1132,300,300:0,I purchased a Toshiba Satellite M60 (with harman/kardon speakers!) in December of 2005.,UNKNOWN#UNKNOWN,UNKNOWN,UNKNOWN,UNKNOWN
1133,300,300:1,It still serves me well both in business and home needs.,UNKNOWN#UNKNOWN,UNKNOWN,UNKNOWN,UNKNOWN
1134,300,300:2,"It is, however, very heavy.",UNKNOWN#UNKNOWN,UNKNOWN,UNKNOWN,UNKNOWN
1135,300,300:3,I recently purchased the mini and absolutely love it!,LAPTOP#GENERAL,positive,GENERAL,LAPTOP
1136,300,300:4,It meets all my needs for work and pleasure while traveling.,LAPTOP#MISCELLANEOUS,positive,MISCELLANEOUS,LAPTOP
1137,300,300:4,It meets all my needs for work and pleasure while traveling.,LAPTOP#PORTABILITY,positive,PORTABILITY,LAPTOP
1138,300,300:5,I am totally satisfied with my little toshie!,LAPTOP#GENERAL,positive,GENERAL,LAPTOP
1139,175,175:0,From the moment I opened the box to the present it has been a great joy.,LAPTOP#GENERAL,positive,GENERAL,LAPTOP
1140,175,175:1,"It is always reliable, never bugged and responds well.",LAPTOP#QUALITY,positive,QUALITY,LAPTOP
1141,175,175:1,"It is always reliable, never bugged and responds well.",LAPTOP#OPERATION_PERFORMANCE,positive,OPERATION_PERFORMANCE,LAPTOP
1142,175,175:2,I love the operating system and the preloaded software.,OS#GENERAL,positive,GENERAL,OS
1143,175,175:2,I love the operating system and the preloaded software.,SOFTWARE#GENERAL,positive,GENERAL,SOFTWARE
1144,288,288:0,I am a freelance graphic artist.,UNKNOWN#UNKNOWN,UNKNOWN,UNKNOWN,UNKNOWN
1145,288,288:1,I need graphic power to run my Adobe Creative apps efficiently.,UNKNOWN#UNKNOWN,UNKNOWN,UNKNOWN,UNKNOWN
1146,288,288:2,This machine delivers.,LAPTOP#OPERATION_PERFORMANCE,positive,OPERATION_PERFORMANCE,LAPTOP
1147,288,288:3,It is much faster than my desktop which is a Core2 Quad running at 2.83 GHz.,UNKNOWN#UNKNOWN,UNKNOWN,UNKNOWN,UNKNOWN
1148,288,288:4,It is also extremely pleasing to the eyes without looking too much like an Alienware gaming machine.,LAPTOP#DESIGN_FEATURES,positive,DESIGN_FEATURES,LAPTOP
1149,288,288:5,I personally like the gaming look but needed a machine that delivered gaming performance while still looking professional in front of my customers.,UNKNOWN#UNKNOWN,UNKNOWN,UNKNOWN,UNKNOWN
1150,288,288:6,It is a bit heavy.,LAPTOP#DESIGN_FEATURES,negative,DESIGN_FEATURES,LAPTOP
1151,288,288:7,It would be a load on long trips where a lot of walking is required.,LAPTOP#PORTABILITY,negative,PORTABILITY,LAPTOP
1152,288,288:8,"If that is the case for you, I would suggest a pull-behind solution when looking at cases.",UNKNOWN#UNKNOWN,UNKNOWN,UNKNOWN,UNKNOWN
1153,288,288:9,Had some trouble finding a case that it would fit in.,LAPTOP#DESIGN_FEATURES,negative,DESIGN_FEATURES,LAPTOP
1154,288,288:10,"This is an over-sized, 18-inch laptop.",LAPTOP#DESIGN_FEATURES,negative,DESIGN_FEATURES,LAPTOP
1155,288,288:11,Most of the large bags are for a 17 inch.,UNKNOWN#UNKNOWN,UNKNOWN,UNKNOWN,UNKNOWN
1156,288,288:12,You may need to special order a bag.,UNKNOWN#UNKNOWN,UNKNOWN,UNKNOWN,UNKNOWN
1157,288,288:13,It wouldn't fit in most 17-inch bags.,LAPTOP#PORTABILITY,negative,PORTABILITY,LAPTOP
1158,288,288:14,I was disappointed when I realized that the keyboard doesn't light up on this model.,KEYBOARD#DESIGN_FEATURES,negative,DESIGN_FEATURES,KEYBOARD
1159,288,288:15,It also does not have bluetooth.,LAPTOP#DESIGN_FEATURES,negative,DESIGN_FEATURES,LAPTOP
1160,288,288:16,Pay attention to the specs if you want these options.,UNKNOWN#UNKNOWN,UNKNOWN,UNKNOWN,UNKNOWN
1161,288,288:17,You'll need to upgrade and pay a little more for them.,LAPTOP#DESIGN_FEATURES,negative,DESIGN_FEATURES,LAPTOP
1162,288,288:18,I should have been more observant.,UNKNOWN#UNKNOWN,UNKNOWN,UNKNOWN,UNKNOWN
1163,288,288:19,"I was looking too closely at the other performance specs and while comparing, I took it for granted that these features were standard.",LAPTOP#DESIGN_FEATURES,negative,DESIGN_FEATURES,LAPTOP
1164,288,288:20,They are not.,UNKNOWN#UNKNOWN,UNKNOWN,UNKNOWN,UNKNOWN
1165,288,288:21,"Overall, still a very nice machine.",LAPTOP#GENERAL,positive,GENERAL,LAPTOP
1166,288,288:22,Boots up fast and runs great!,LAPTOP#OPERATION_PERFORMANCE,positive,OPERATION_PERFORMANCE,LAPTOP
1167,288,288:23,I'm pleased.,LAPTOP#GENERAL,positive,GENERAL,LAPTOP
1168,289,289:0,The acer one compuer is a great computer.,LAPTOP#GENERAL,positive,GENERAL,LAPTOP
1169,289,289:1,I didn't want to buy a generic brand computer but it is really nice.,LAPTOP#GENERAL,positive,GENERAL,LAPTOP
1170,289,289:1,I didn't want to buy a generic brand computer but it is really nice.,COMPANY#GENERAL,neutral,GENERAL,COMPANY
1171,289,289:2,"Its fast, has High definition quality in the videos.",LAPTOP#OPERATION_PERFORMANCE,positive,OPERATION_PERFORMANCE,LAPTOP
1172,289,289:2,"Its fast, has High definition quality in the videos.",DISPLAY#QUALITY,positive,QUALITY,DISPLAY
1173,289,289:3,The pictures are clear as can be.,DISPLAY#QUALITY,positive,QUALITY,DISPLAY
1174,289,289:4,"If I had to buy another computer, I would most definetly buy an acer one computer.",LAPTOP#GENERAL,positive,GENERAL,LAPTOP
1175,289,289:4,"If I had to buy another computer, I would most definetly buy an acer one computer.",COMPANY#GENERAL,positive,GENERAL,COMPANY
1176,289,289:5,"Heck, if I had enough ' money, I would but it as a gift for someone.",LAPTOP#GENERAL,positive,GENERAL,LAPTOP
1177,289,289:6,Im glad that it has such great features in it.,LAPTOP#DESIGN_FEATURES,positive,DESIGN_FEATURES,LAPTOP
1178,289,289:7,It also came with a built it web cam which is great because I can see an communicate with my family members back home.,LAPTOP#DESIGN_FEATURES,positive,DESIGN_FEATURES,LAPTOP
1179,289,289:8,Clear picture on it and everything.,DISPLAY#QUALITY,positive,QUALITY,DISPLAY
1180,289,289:9,"The one down side to it is that when I play a certin game on here, it tends to freeze up sometimes, but thats the only bad thing about this computer.",LAPTOP#OPERATION_PERFORMANCE,negative,OPERATION_PERFORMANCE,LAPTOP
1181,289,289:9,"The one down side to it is that when I play a certin game on here, it tends to freeze up sometimes, but thats the only bad thing about this computer.",LAPTOP#GENERAL,positive,GENERAL,LAPTOP
1182,289,289:10,"The acer one computer that I bought is 17 ince screen and its hard to find lap top bags for it, but I like the big screen on it.",DISPLAY#DESIGN_FEATURES,positive,DESIGN_FEATURES,DISPLAY
1183,289,289:10,"The acer one computer that I bought is 17 ince screen and its hard to find lap top bags for it, but I like the big screen on it.",LAPTOP#PORTABILITY,negative,PORTABILITY,LAPTOP
1184,289,289:11,Its good for playing my apps on Facebook or watching movies.,LAPTOP#MISCELLANEOUS,positive,MISCELLANEOUS,LAPTOP
1185,289,289:12,Im very happy with this computer!,LAPTOP#GENERAL,positive,GENERAL,LAPTOP
1186,302,302:0,"Well, I have to say since I bought my Mac, I won't ever go back to any Windows.",UNKNOWN#UNKNOWN,UNKNOWN,UNKNOWN,UNKNOWN
1187,302,302:1,It's solid.,LAPTOP#QUALITY,positive,QUALITY,LAPTOP
1188,302,302:2,Love the stability of the Mac software and operating system.,SOFTWARE#OPERATION_PERFORMANCE,positive,OPERATION_PERFORMANCE,SOFTWARE
1189,302,302:2,Love the stability of the Mac software and operating system.,OS#OPERATION_PERFORMANCE,positive,OPERATION_PERFORMANCE,OS
1190,302,302:3,The only downfall is a lot of the software I have won't work with Mac and iWork is not worth the price of it.,SOFTWARE#USABILITY,negative,USABILITY,SOFTWARE
1191,302,302:3,The only downfall is a lot of the software I have won't work with Mac and iWork is not worth the price of it.,SOFTWARE#GENERAL,negative,GENERAL,SOFTWARE
1192,302,302:3,The only downfall is a lot of the software I have won't work with Mac and iWork is not worth the price of it.,SOFTWARE#PRICE,negative,PRICE,SOFTWARE
1193,302,302:4,It seems to be incompatible with everything else.,SOFTWARE#USABILITY,negative,USABILITY,SOFTWARE
1194,302,302:5,But the machine is awesome and iLife is great and I love Snow Leopard X.,LAPTOP#GENERAL,positive,GENERAL,LAPTOP
1195,302,302:5,But the machine is awesome and iLife is great and I love Snow Leopard X.,SOFTWARE#GENERAL,positive,GENERAL,SOFTWARE
1196,302,302:5,But the machine is awesome and iLife is great and I love Snow Leopard X.,OS#GENERAL,positive,GENERAL,OS
1197,303,303:0,i love to use it it is esay and light.,LAPTOP#GENERAL,positive,GENERAL,LAPTOP
1198,303,303:0,i love to use it it is esay and light.,LAPTOP#USABILITY,positive,USABILITY,LAPTOP
1199,303,303:0,i love to use it it is esay and light.,LAPTOP#DESIGN_FEATURES,positive,DESIGN_FEATURES,LAPTOP
1200,303,303:1,this laptop is durable and it is easy to travel with.,LAPTOP#QUALITY,positive,QUALITY,LAPTOP
1201,303,303:1,this laptop is durable and it is easy to travel with.,LAPTOP#PORTABILITY,positive,PORTABILITY,LAPTOP
1202,303,303:2,i needed one to be able to carry to work everyday and this one seems to fit all of the criteria.,LAPTOP#PORTABILITY,positive,PORTABILITY,LAPTOP
1203,303,303:3,this laptop is great for work and doing my pictures.,LAPTOP#MISCELLANEOUS,positive,MISCELLANEOUS,LAPTOP
1204,303,303:4,"i am a huge computer person i love anykind of computer that works well, but when i got this one i was so happy with the way it works and how it runs its amazing.",LAPTOP#OPERATION_PERFORMANCE,positive,OPERATION_PERFORMANCE,LAPTOP
1205,303,303:5,the programs are esay to use and are quick to process this computer works like a charm.,SOFTWARE#USABILITY,positive,USABILITY,SOFTWARE
1206,303,303:5,the programs are esay to use and are quick to process this computer works like a charm.,SOFTWARE#OPERATION_PERFORMANCE,positive,OPERATION_PERFORMANCE,SOFTWARE
1207,303,303:5,the programs are esay to use and are quick to process this computer works like a charm.,LAPTOP#OPERATION_PERFORMANCE,positive,OPERATION_PERFORMANCE,LAPTOP
1208,303,303:6,i can use it for all of my needs.,LAPTOP#GENERAL,positive,GENERAL,LAPTOP
1209,303,303:7,i give this laptop a five star review i love it and it has done chams for me.,LAPTOP#GENERAL,positive,GENERAL,LAPTOP
1210,303,303:8,if this computer every breaks down on me i will most definatly get the same one again.,LAPTOP#GENERAL,positive,GENERAL,LAPTOP
1211,303,303:9,i think that anyone looking for a good durrable laptop then this is the way to go.,LAPTOP#QUALITY,positive,QUALITY,LAPTOP
1212,303,303:9,i think that anyone looking for a good durrable laptop then this is the way to go.,LAPTOP#GENERAL,positive,GENERAL,LAPTOP
1213,304,304:0,From the second you open the box you will fall in love with this computer!,LAPTOP#GENERAL,positive,GENERAL,LAPTOP
1214,304,304:1,The OS is still as fast as the day that the laptop was purchased and continues to run flawlessly.,OS#OPERATION_PERFORMANCE,positive,OPERATION_PERFORMANCE,OS
1215,304,304:1,The OS is still as fast as the day that the laptop was purchased and continues to run flawlessly.,OS#QUALITY,positive,QUALITY,OS
1216,304,304:2,"The track pad to me is what really stands out though, you can do several different things with it just depending on how many fingers you use on the track pad, awesome thinking Apple!",MOUSE#DESIGN_FEATURES,positive,DESIGN_FEATURES,MOUSE
1217,304,304:2,"The track pad to me is what really stands out though, you can do several different things with it just depending on how many fingers you use on the track pad, awesome thinking Apple!",MOUSE#USABILITY,positive,USABILITY,MOUSE
1218,304,304:2,"The track pad to me is what really stands out though, you can do several different things with it just depending on how many fingers you use on the track pad, awesome thinking Apple!",COMPANY#GENERAL,positive,GENERAL,COMPANY
1219,304,304:3,"Have not yet needed any customer support with this yet so to me that is a great thing, which is leaps and bounds ahead of PC in my opinion.",UNKNOWN#UNKNOWN,UNKNOWN,UNKNOWN,UNKNOWN
1220,304,304:4,"The OS is also very user friendly, even for those that switch from a PC, with a little practice you can take full advantage of this OS!",OS#USABILITY,positive,USABILITY,OS
1221,304,304:5,Apple continues to shine and provide a much more enjoyable computer experience!,COMPANY#GENERAL,positive,GENERAL,COMPANY
1222,304,304:5,Apple continues to shine and provide a much more enjoyable computer experience!,LAPTOP#GENERAL,positive,GENERAL,LAPTOP
1223,31,31:0,"From the start, when you open the box you see a completely different class of machine.",LAPTOP#GENERAL,positive,GENERAL,LAPTOP
1224,31,31:1,The ease in which you set everything up is such that a child could do it.,LAPTOP#USABILITY,positive,USABILITY,LAPTOP
1225,31,31:2,"The screen is bright and clear, the operating system is solid and friendly to a novice.",DISPLAY#QUALITY,positive,QUALITY,DISPLAY
1226,31,31:2,"The screen is bright and clear, the operating system is solid and friendly to a novice.",OS#QUALITY,positive,QUALITY,OS
1227,31,31:2,"The screen is bright and clear, the operating system is solid and friendly to a novice.",OS#USABILITY,positive,USABILITY,OS
1228,31,31:3,"Fast, fast and fast, the web pages just fly by.",LAPTOP#OPERATION_PERFORMANCE,positive,OPERATION_PERFORMANCE,LAPTOP
1229,31,31:4,"I had my IWORKS, Itunes, Email, MS Office, network and printers set up and completely working perfectly within an hour.",LAPTOP#USABILITY,positive,USABILITY,LAPTOP
1230,31,31:4,"I had my IWORKS, Itunes, Email, MS Office, network and printers set up and completely working perfectly within an hour.",LAPTOP#CONNECTIVITY,positive,CONNECTIVITY,LAPTOP
1231,31,31:4,"I had my IWORKS, Itunes, Email, MS Office, network and printers set up and completely working perfectly within an hour.",LAPTOP#OPERATION_PERFORMANCE,positive,OPERATION_PERFORMANCE,LAPTOP
1232,31,31:5,That includes transferring my music and movies.,LAPTOP#USABILITY,positive,USABILITY,LAPTOP
1233,31,31:6,Good bye BLUE SCREEN and Critical errors!!!!,LAPTOP#OPERATION_PERFORMANCE,positive,OPERATION_PERFORMANCE,LAPTOP
1234,31,31:7,Skype is just so dang cool with this machine too.,SOFTWARE#GENERAL,positive,GENERAL,SOFTWARE
1235,31,31:8,I can hardly wait to see whats around the next corner.,UNKNOWN#UNKNOWN,UNKNOWN,UNKNOWN,UNKNOWN
1236,31,31:9,"My Iphone synced right up just like a person would expect, unlike the PCs in our lives.",UNKNOWN#UNKNOWN,UNKNOWN,UNKNOWN,UNKNOWN
1237,31,31:10,If only Bill Gates would read some of what is said here MS would do a better job.,UNKNOWN#UNKNOWN,UNKNOWN,UNKNOWN,UNKNOWN
1238,31,31:11,"If your time is worth anything to you, if you are tired of rebooting, reformatting, reinstalling, trying to find drivers, if you want a computer to work for you for a change, make the change to this computer.",LAPTOP#USABILITY,positive,USABILITY,LAPTOP
1239,31,31:11,"If your time is worth anything to you, if you are tired of rebooting, reformatting, reinstalling, trying to find drivers, if you want a computer to work for you for a change, make the change to this computer.",LAPTOP#OPERATION_PERFORMANCE,positive,OPERATION_PERFORMANCE,LAPTOP
1240,31,31:12,It is light and the battery last a very long time.,LAPTOP#DESIGN_FEATURES,positive,DESIGN_FEATURES,LAPTOP
1241,31,31:12,It is light and the battery last a very long time.,BATTERY#OPERATION_PERFORMANCE,positive,OPERATION_PERFORMANCE,BATTERY
1242,31,31:13,Very fast boot up and shut down.,LAPTOP#OPERATION_PERFORMANCE,positive,OPERATION_PERFORMANCE,LAPTOP
1243,314,314:0,"been a PC user for many, many years.",UNKNOWN#UNKNOWN,UNKNOWN,UNKNOWN,UNKNOWN
1244,314,314:1,"Let me tell you, this machine is great.",LAPTOP#GENERAL,positive,GENERAL,LAPTOP
1245,314,314:2,"Purchased for development purposes, but it has turned into my everyday laptop as well for surfing, e-mail, etc.",LAPTOP#MISCELLANEOUS,positive,MISCELLANEOUS,LAPTOP
1246,314,314:3,"I thought learning the Mac OS would be hard, but it is easily picked up if you are familiar with a PC.",OS#USABILITY,positive,USABILITY,OS
1247,314,314:4,The most amazing part to me as a PC user is the startup and shutdown times - and the fact that you very rarely have to restart the thing.,LAPTOP#OPERATION_PERFORMANCE,positive,OPERATION_PERFORMANCE,LAPTOP
1248,314,314:5,The only time I have restarted is during system updates.,LAPTOP#OPERATION_PERFORMANCE,positive,OPERATION_PERFORMANCE,LAPTOP
1249,314,314:6,great machine if you want to drop the cash for one.,LAPTOP#GENERAL,positive,GENERAL,LAPTOP
1250,317,317:0,"Ok, this is probably the best laptop series ever devised by Apple.",LAPTOP#GENERAL,positive,GENERAL,LAPTOP
1251,317,317:1,The case is carved out of a single block of aluminum.,LAPTOP#QUALITY,positive,QUALITY,LAPTOP
1252,317,317:2,"Although I opted for the lowest end MacBook Pro, this thing holds its own.",UNKNOWN#UNKNOWN,UNKNOWN,UNKNOWN,UNKNOWN
1253,317,317:3,"The processor screams, and because of the unique way that Apple OSX 16 functions, most of the graphics are routed through the hardware rather than the software.",CPU#OPERATION_PERFORMANCE,positive,OPERATION_PERFORMANCE,CPU
1254,317,317:3,"The processor screams, and because of the unique way that Apple OSX 16 functions, most of the graphics are routed through the hardware rather than the software.",OS#OPERATION_PERFORMANCE,positive,OPERATION_PERFORMANCE,OS
1255,317,317:3,"The processor screams, and because of the unique way that Apple OSX 16 functions, most of the graphics are routed through the hardware rather than the software.",GRAPHICS#DESIGN_FEATURES,positive,DESIGN_FEATURES,GRAPHICS
1256,317,317:4,That is how it is able to function better than any other PC.,UNKNOWN#UNKNOWN,UNKNOWN,UNKNOWN,UNKNOWN
1257,317,317:5,I have recommended this laptop to everyone I know who is buying one.,LAPTOP#GENERAL,positive,GENERAL,LAPTOP
1258,317,317:6,"I like it so much, I bought another just for my wife.",LAPTOP#GENERAL,positive,GENERAL,LAPTOP
1259,331,331:0,Took it back as it was defective.,LAPTOP#QUALITY,negative,QUALITY,LAPTOP
1260,331,331:1,Page just disapeared after you got yahoo or downloaded something.,LAPTOP#OPERATION_PERFORMANCE,negative,OPERATION_PERFORMANCE,LAPTOP
1261,331,331:2,Couldn't keep a page up you were working on!,LAPTOP#OPERATION_PERFORMANCE,negative,OPERATION_PERFORMANCE,LAPTOP
1262,356,356:0,was a great deal i will give that.,LAPTOP#PRICE,positive,PRICE,LAPTOP
1263,356,356:1,the laptop preformed pretty well.,LAPTOP#OPERATION_PERFORMANCE,positive,OPERATION_PERFORMANCE,LAPTOP
1264,356,356:2,it cant fuction well with lots of webpages open at once.,LAPTOP#OPERATION_PERFORMANCE,negative,OPERATION_PERFORMANCE,LAPTOP
1265,356,356:3,it has times were it freezes for 10 seconds and then starts again.,LAPTOP#OPERATION_PERFORMANCE,negative,OPERATION_PERFORMANCE,LAPTOP
1266,356,356:4,"the mouse on the pad, the left button always sticks.",MOUSE#OPERATION_PERFORMANCE,negative,OPERATION_PERFORMANCE,MOUSE
1267,356,356:5,the mouse is way way way to sensitve.,MOUSE#OPERATION_PERFORMANCE,negative,OPERATION_PERFORMANCE,MOUSE
1268,356,356:6,i tried turning it done but it did nothing.,MOUSE#OPERATION_PERFORMANCE,negative,OPERATION_PERFORMANCE,MOUSE
1269,356,356:7,the mouse jumps around all the time and it clicks stuff i dont want it too.,MOUSE#OPERATION_PERFORMANCE,negative,OPERATION_PERFORMANCE,MOUSE
1270,356,356:7,the mouse jumps around all the time and it clicks stuff i dont want it too.,MOUSE#USABILITY,negative,USABILITY,MOUSE
1271,356,356:8,its not bad just VERY VERY annoying.,MOUSE#GENERAL,negative,GENERAL,MOUSE
1272,356,356:9,think i would spend little extra to get a better made laptop.,LAPTOP#QUALITY,negative,QUALITY,LAPTOP
1273,363,363:0,I am very happy with this laptop.,LAPTOP#GENERAL,positive,GENERAL,LAPTOP
1274,363,363:1,For the price and what I get out of it has exceeded my expectations.,LAPTOP#PRICE,neutral,PRICE,LAPTOP
1275,363,363:1,For the price and what I get out of it has exceeded my expectations.,LAPTOP#GENERAL,positive,GENERAL,LAPTOP
1276,363,363:2,I always have used a tower home PC and jumped to the laptop and have been very satisfied with its performance.,LAPTOP#OPERATION_PERFORMANCE,positive,OPERATION_PERFORMANCE,LAPTOP
1277,296,296:0,"First things first, Macbook pro has many applications to make life easier, unlike the windows computers.",UNKNOWN#UNKNOWN,UNKNOWN,UNKNOWN,UNKNOWN
1278,296,296:1,Amazing Quality!,LAPTOP#QUALITY,positive,QUALITY,LAPTOP
1279,296,296:2,Plus stylish.,LAPTOP#DESIGN_FEATURES,positive,DESIGN_FEATURES,LAPTOP
1280,296,296:3,"The big screen allows you to enjoy watching movies , pictures and etc!",DISPLAY#DESIGN_FEATURES,positive,DESIGN_FEATURES,DISPLAY
1281,296,296:4,"The flaws are, this computer is not for computer gamers because of the OS X.",LAPTOP#MISCELLANEOUS,negative,MISCELLANEOUS,LAPTOP
1282,296,296:4,"The flaws are, this computer is not for computer gamers because of the OS X.",OS#MISCELLANEOUS,negative,MISCELLANEOUS,OS
1283,296,296:5,Mac is not made for gaming.,LAPTOP#MISCELLANEOUS,negative,MISCELLANEOUS,LAPTOP
1284,296,296:6,BUT there's this application called Boot Camp which allows you to add another OS X like Windows.,SOFTWARE#MISCELLANEOUS,positive,MISCELLANEOUS,SOFTWARE
1285,296,296:7,"Second, it gets scratches easily and when it gets old some thing may operated",LAPTOP#QUALITY,negative,QUALITY,LAPTOP
1286,296,296:7,"Second, it gets scratches easily and when it gets old some thing may operated",LAPTOP#OPERATION_PERFORMANCE,negative,OPERATION_PERFORMANCE,LAPTOP
1287,346,346:0,Was not happy with one of the programs on it.,SOFTWARE#GENERAL,negative,GENERAL,SOFTWARE
1288,346,346:1,"It was not clear that the Microsoft Student Edition that was loaded on the computer, was a six month trial.",SOFTWARE#MISCELLANEOUS,negative,MISCELLANEOUS,SOFTWARE
1289,346,346:2,"Also, the extended warranty was a problem.",WARRANTY#GENERAL,negative,GENERAL,WARRANTY
1290,346,346:3,The extended warranty for the $4000 and up computers was the only one available for purchase on the drop drown menu.,WARRANTY#MISCELLANEOUS,negative,MISCELLANEOUS,WARRANTY
1291,346,346:4,"Overall the computer is very easy to use, the screen is perfect, great computer, my daughter loves.",LAPTOP#USABILITY,positive,USABILITY,LAPTOP
1292,346,346:4,"Overall the computer is very easy to use, the screen is perfect, great computer, my daughter loves.",DISPLAY#GENERAL,positive,GENERAL,DISPLAY
1293,346,346:4,"Overall the computer is very easy to use, the screen is perfect, great computer, my daughter loves.",LAPTOP#GENERAL,positive,GENERAL,LAPTOP
1294,343,343:0,I took 3-4 years researching brands and prices of laptops.,UNKNOWN#UNKNOWN,UNKNOWN,UNKNOWN,UNKNOWN
1295,343,343:1,I finally decided on this laptop because it was the right price for what I need it.,LAPTOP#PRICE,positive,PRICE,LAPTOP
1296,343,343:1,I finally decided on this laptop because it was the right price for what I need it.,LAPTOP#GENERAL,positive,GENERAL,LAPTOP
