,rid,sid,text,category,polarity,attribute,entity
1676,269,269:1,You can do it all on this bad boy but the main thing this netbook was desinged for was surfing the web and boy o boy does it ever.,LAPTOP#MISCELLANEOUS,positive,MISCELLANEOUS,LAPTOP
1677,269,269:2,for being so small it is amazing that it is as fast as it is.,LAPTOP#DESIGN_FEATURES,neutral,DESIGN_FEATURES,LAPTOP
1678,269,269:2,for being so small it is amazing that it is as fast as it is.,LAPTOP#OPERATION_PERFORMANCE,positive,OPERATION_PERFORMANCE,LAPTOP
1679,269,269:3,when i first got it i thought the size of it was a joke.,LAPTOP#DESIGN_FEATURES,neutral,DESIGN_FEATURES,LAPTOP
1680,269,269:4,but after i got used to it i love it.,LAPTOP#DESIGN_FEATURES,positive,DESIGN_FEATURES,LAPTOP
1681,269,269:5,the size of has actually help me out quite a bit by me being able to fit it in an already full backpack and to use it at a resturant where the food on the table is always so space consuming.,LAPTOP#DESIGN_FEATURES,positive,DESIGN_FEATURES,LAPTOP
1682,269,269:5,the size of has actually help me out quite a bit by me being able to fit it in an already full backpack and to use it at a resturant where the food on the table is always so space consuming.,LAPTOP#PORTABILITY,positive,PORTABILITY,LAPTOP
1683,269,269:5,the size of has actually help me out quite a bit by me being able to fit it in an already full backpack and to use it at a resturant where the food on the table is always so space consuming.,LAPTOP#USABILITY,positive,USABILITY,LAPTOP
1684,269,269:6,"it has 3 usb ports, 1 sd memory card reader and an sd memory car expansion.",LAPTOP#DESIGN_FEATURES,positive,DESIGN_FEATURES,LAPTOP
1685,269,269:7,the only down fall is that it has no cd drive but i found that they are very cheap to by and also very portable making this the best friend to someone who is always looking for more space then they have.,LAPTOP#DESIGN_FEATURES,neutral,DESIGN_FEATURES,LAPTOP
1686,269,269:7,the only down fall is that it has no cd drive but i found that they are very cheap to by and also very portable making this the best friend to someone who is always looking for more space then they have.,LAPTOP#PORTABILITY,negative,PORTABILITY,LAPTOP
1687,269,269:8,overall i would recomend this to anybody and tell them that if they want to burn their music or play there video games to buy the cd drive.,LAPTOP#GENERAL,positive,GENERAL,LAPTOP
1688,269,269:8,overall i would recomend this to anybody and tell them that if they want to burn their music or play there video games to buy the cd drive.,LAPTOP#MISCELLANEOUS,neutral,MISCELLANEOUS,LAPTOP
1689,246,246:0,"i would never go back any more, i love this computer so much and i would recommend it to everyone.",UNKNOWN#UNKNOWN,UNKNOWN,UNKNOWN,UNKNOWN
1690,246,246:1,"i use my mac all the time, i love the software, the way it takes a short time to load things, how easy it is to use and most of all how you don't have to worry about viruses.",LAPTOP#OPERATION_PERFORMANCE,positive,OPERATION_PERFORMANCE,LAPTOP
1691,246,246:1,"i use my mac all the time, i love the software, the way it takes a short time to load things, how easy it is to use and most of all how you don't have to worry about viruses.",LAPTOP#USABILITY,positive,USABILITY,LAPTOP
1692,246,246:1,"i use my mac all the time, i love the software, the way it takes a short time to load things, how easy it is to use and most of all how you don't have to worry about viruses.",SOFTWARE#GENERAL,positive,GENERAL,SOFTWARE
1693,246,246:1,"i use my mac all the time, i love the software, the way it takes a short time to load things, how easy it is to use and most of all how you don't have to worry about viruses.",LAPTOP#QUALITY,positive,QUALITY,LAPTOP
1694,246,246:2,"With a mac you don't have to worry about antivirus software or firewall, it's so wonderful.",LAPTOP#QUALITY,positive,QUALITY,LAPTOP
1695,246,246:3,this computer is a little more expensive than any pc but it will last you longer and it worth every penny.,UNKNOWN#UNKNOWN,UNKNOWN,UNKNOWN,UNKNOWN
1696,246,246:4,"All apple associates are always wiling to help you out with anything, no matter when you purchased the computer and how many years passed.",SUPPORT#QUALITY,positive,QUALITY,SUPPORT
1697,246,246:5,"this computer will last you at least 7 years, thats an amazing life spanned an electronic.",LAPTOP#QUALITY,positive,QUALITY,LAPTOP
1698,246,246:6,"everything about a mac is wonderful, it takes a little used to learning and getting used to the new system, but you will learn fast and its all worth it.",LAPTOP#GENERAL,positive,GENERAL,LAPTOP
1699,246,246:6,"everything about a mac is wonderful, it takes a little used to learning and getting used to the new system, but you will learn fast and its all worth it.",OS#USABILITY,positive,USABILITY,OS
1700,25,25:0,Not working = bad,LAPTOP#OPERATION_PERFORMANCE,negative,OPERATION_PERFORMANCE,LAPTOP
1701,25,25:1,"I spent 2200 dollars on a ""top of the line laptop"".",LAPTOP#PRICE,negative,PRICE,LAPTOP
1702,25,25:1,"I spent 2200 dollars on a ""top of the line laptop"".",LAPTOP#QUALITY,negative,QUALITY,LAPTOP
1703,25,25:2,I got the blue screen of death the first month I got it.,LAPTOP#OPERATION_PERFORMANCE,negative,OPERATION_PERFORMANCE,LAPTOP
1704,25,25:2,I got the blue screen of death the first month I got it.,LAPTOP#QUALITY,negative,QUALITY,LAPTOP
1705,25,25:3,"1) Payed $2200 for a ""premium"" laptop",LAPTOP#PRICE,negative,PRICE,LAPTOP
1706,25,25:3,"1) Payed $2200 for a ""premium"" laptop",LAPTOP#QUALITY,negative,QUALITY,LAPTOP
1707,25,25:4,2) Blue screen first month,LAPTOP#OPERATION_PERFORMANCE,negative,OPERATION_PERFORMANCE,LAPTOP
1708,25,25:4,2) Blue screen first month,LAPTOP#QUALITY,negative,QUALITY,LAPTOP
1709,25,25:5,3) Horrible customer support-they lost my laptop for a month-got it back 3 months later,SUPPORT#QUALITY,negative,QUALITY,SUPPORT
1710,25,25:6,"4) Laptop still did not work, blue screen within a week...",SUPPORT#QUALITY,negative,QUALITY,SUPPORT
1711,25,25:7,5) Cut my losses and sold it for parts,LAPTOP#GENERAL,negative,GENERAL,LAPTOP
1712,25,25:8,"Do yourself a favor, this is not a fake story trying to hurt alienware...",UNKNOWN#UNKNOWN,UNKNOWN,UNKNOWN,UNKNOWN
1713,25,25:9,"this company truely does make horrible products and doesnt seem to because they are certain things like this ""never"" happen...",COMPANY#GENERAL,negative,GENERAL,COMPANY
1714,25,25:10,do a quick search on the internet see if im the only one.,UNKNOWN#UNKNOWN,UNKNOWN,UNKNOWN,UNKNOWN
1715,256,256:0,I'm new - just switched from years of PC frustration.,UNKNOWN#UNKNOWN,UNKNOWN,UNKNOWN,UNKNOWN
1716,256,256:1,"what an elegant, wonderful machine.",LAPTOP#DESIGN_FEATURES,positive,DESIGN_FEATURES,LAPTOP
1717,256,256:1,"what an elegant, wonderful machine.",LAPTOP#GENERAL,positive,GENERAL,LAPTOP
1718,256,256:2,"I'm making the switch and finding that my biggest problem is trying to do things the 'old' way - and Apple does, indeed, have the better idea.",LAPTOP#GENERAL,positive,GENERAL,LAPTOP
1719,256,256:3,I really wish I had done this years ago.,LAPTOP#GENERAL,positive,GENERAL,LAPTOP
1720,256,256:4,Pairing it with an iPhone is a pure pleasure - talk about painless syncing - used to take me forever - now it's a snap.,LAPTOP#CONNECTIVITY,positive,CONNECTIVITY,LAPTOP
1721,256,256:5,Thank you Best Buy for putting my computer together and installing my first software - you guys were GREAT too!,UNKNOWN#UNKNOWN,UNKNOWN,UNKNOWN,UNKNOWN
1722,256,256:6,I love it - never had a computer I was so impressed with - and I've had a lot of laptops and desktops - this one is FAR AND ABOVE THE BEST ONE I EVER HAD BEFORE.,LAPTOP#GENERAL,positive,GENERAL,LAPTOP
1723,94,94:0,"I tell everyone that I know, friends, family and enemies this is the absolute worst computer i have ever used.",LAPTOP#GENERAL,negative,GENERAL,LAPTOP
1724,94,94:1,The computer blinks it shuts off at will.,LAPTOP#OPERATION_PERFORMANCE,negative,OPERATION_PERFORMANCE,LAPTOP
1725,94,94:2,The letter A stopped working after the first week.,KEYBOARD#QUALITY,negative,QUALITY,KEYBOARD
1726,94,94:2,The letter A stopped working after the first week.,KEYBOARD#OPERATION_PERFORMANCE,negative,OPERATION_PERFORMANCE,KEYBOARD
1727,94,94:3,when i called to have another one shipped or to get my money back they said the return policy is 23 twenty three days from the date of purchase.,SUPPORT#QUALITY,negative,QUALITY,SUPPORT
1728,94,94:4,not the day received.,UNKNOWN#UNKNOWN,UNKNOWN,UNKNOWN,UNKNOWN
1729,94,94:5,so the fact that the computer does not work on the 24 twenty fourth day is my fault.,SUPPORT#QUALITY,negative,QUALITY,SUPPORT
1730,94,94:5,so the fact that the computer does not work on the 24 twenty fourth day is my fault.,LAPTOP#QUALITY,negative,QUALITY,LAPTOP
1731,94,94:6,they have done absolutely nothing to fix the computer problem.,SUPPORT#QUALITY,negative,QUALITY,SUPPORT
1732,94,94:7,they have not sent a new one nor called.,SUPPORT#QUALITY,negative,QUALITY,SUPPORT
1733,94,94:8,i spent eight hundred dollars from a giant paper weight that looks good on a bus.,LAPTOP#DESIGN_FEATURES,neutral,DESIGN_FEATURES,LAPTOP
1734,94,94:8,i spent eight hundred dollars from a giant paper weight that looks good on a bus.,LAPTOP#PRICE,negative,PRICE,LAPTOP
1735,94,94:9,then on top of it all their cusromer service center is in the middle east.,SUPPORT#MISCELLANEOUS,negative,MISCELLANEOUS,SUPPORT
1736,94,94:10,So when you do call to complain about the hunk of metal you get the joy of speaking with a bunch of people you cant understand.,SUPPORT#QUALITY,negative,QUALITY,SUPPORT
1737,94,94:11,"Then to make matters worst, there is noone that they can transfer you to.",SUPPORT#QUALITY,negative,QUALITY,SUPPORT
1738,94,94:12,its sad because their commercials are great.,UNKNOWN#UNKNOWN,UNKNOWN,UNKNOWN,UNKNOWN
1739,96,96:0,I had this computer for one month and had to send it in for repair.,LAPTOP#QUALITY,negative,QUALITY,LAPTOP
1740,96,96:1,Got the computer back a month later and it was still broken sent it out again and they repaired it.,SUPPORT#QUALITY,negative,QUALITY,SUPPORT
1741,96,96:2,3 weeks went by and the computer keeps crashing and will not open any applications.,SUPPORT#QUALITY,negative,QUALITY,SUPPORT
1742,96,96:3,DO NOT BUY GATEWAY COMPUTERS THEY ARE JUNK AND THE WARRANTY COMPANY IS HORRIBLE.,SUPPORT#QUALITY,negative,QUALITY,SUPPORT
1743,96,96:3,DO NOT BUY GATEWAY COMPUTERS THEY ARE JUNK AND THE WARRANTY COMPANY IS HORRIBLE.,COMPANY#GENERAL,negative,GENERAL,COMPANY
1744,96,96:4,YOU WILL NOT BE ABLE TO TALK TO AN AMERICAN WARRANTY SERVICE IS OUT OF COUNTRY.,SUPPORT#QUALITY,negative,QUALITY,SUPPORT
1745,96,96:5,COMPUTER HAS BEEN AT SERVICE FACILITY MORE THAN IN MY HANDS.,LAPTOP#QUALITY,negative,QUALITY,LAPTOP
1746,374,374:0,I have had this laptop for a few months now and i would say im pretty satisfied.,LAPTOP#GENERAL,positive,GENERAL,LAPTOP
1747,374,374:1,The only problems are the sound isnt very loud I have to wear headphones.,MULTIMEDIA_DEVICES#QUALITY,negative,QUALITY,MULTIMEDIA_DEVICES
1748,374,374:2,Another thing is that after only a month the left mouse key broke and it costed $175 to send it in to fix it.,MOUSE#QUALITY,negative,QUALITY,MOUSE
1749,374,374:2,Another thing is that after only a month the left mouse key broke and it costed $175 to send it in to fix it.,SUPPORT#PRICE,negative,PRICE,SUPPORT
1750,374,374:3,That whole experience was just ridiculous we sent it in and after they told us that we had to pay $175 to fix it we were like we will just by a portable mouse which would be way cheaper but they refused to send the laptop back until we paid the $175 and it was fixed.,SUPPORT#PRICE,negative,PRICE,SUPPORT
1751,374,374:3,That whole experience was just ridiculous we sent it in and after they told us that we had to pay $175 to fix it we were like we will just by a portable mouse which would be way cheaper but they refused to send the laptop back until we paid the $175 and it was fixed.,SUPPORT#QUALITY,negative,QUALITY,SUPPORT
1752,374,374:4,It took a little over 2 weeks until i got it back.,SUPPORT#QUALITY,negative,QUALITY,SUPPORT
1753,374,374:5,ANd I babyed the heck out of it just one day when i opened it turned it on went to click and it was broke.,MOUSE#QUALITY,negative,QUALITY,MOUSE
1754,374,374:6,I babyed the heck out of it and i still do.,UNKNOWN#UNKNOWN,UNKNOWN,UNKNOWN,UNKNOWN
1755,374,374:7,To be honest i think it was faulty equipment or something but idk.,LAPTOP#QUALITY,negative,QUALITY,LAPTOP
1756,374,374:8,The graphics are great.,GRAPHICS#GENERAL,positive,GENERAL,GRAPHICS
1757,374,374:9,The internet speed is spectacular.,LAPTOP#OPERATION_PERFORMANCE,positive,OPERATION_PERFORMANCE,LAPTOP
1758,374,374:9,The internet speed is spectacular.,LAPTOP#CONNECTIVITY,positive,CONNECTIVITY,LAPTOP
1759,374,374:10,The battery life is probably an hour at best.,BATTERY#OPERATION_PERFORMANCE,negative,OPERATION_PERFORMANCE,BATTERY
1760,374,374:11,Oh and it has word and stuff but its a trial verion so after about a month or so when you go to open it it asks for a product key which didnt come with the computer and even after clicking cancel it wont let you use it at all I use the old word processer which works good.,SOFTWARE#MISCELLANEOUS,negative,MISCELLANEOUS,SOFTWARE
1761,374,374:12,I would recommend it just because of the internet speed probably because thats the only thing i really care about.,LAPTOP#OPERATION_PERFORMANCE,positive,OPERATION_PERFORMANCE,LAPTOP
1762,374,374:12,I would recommend it just because of the internet speed probably because thats the only thing i really care about.,LAPTOP#CONNECTIVITY,positive,CONNECTIVITY,LAPTOP
1763,374,374:13,I wish the volume could be louder and the mouse didnt break after only a month.,MULTIMEDIA_DEVICES#QUALITY,negative,QUALITY,MULTIMEDIA_DEVICES
1764,374,374:13,I wish the volume could be louder and the mouse didnt break after only a month.,MOUSE#QUALITY,negative,QUALITY,MOUSE
1765,349,349:0,I received this laptop as a gift and let me just tell you that its the worst.,LAPTOP#GENERAL,negative,GENERAL,LAPTOP
1766,349,349:1,At first it worked well for a month or so then the system board failed and I send it in to toshiba some complaints and three weeks later I then receive my laptop back only to discover that it still has the same problem so now I have to send it back again to get it fixed again.,LAPTOP#QUALITY,negative,QUALITY,LAPTOP
1767,349,349:1,At first it worked well for a month or so then the system board failed and I send it in to toshiba some complaints and three weeks later I then receive my laptop back only to discover that it still has the same problem so now I have to send it back again to get it fixed again.,MOTHERBOARD#QUALITY,negative,QUALITY,MOTHERBOARD
1768,349,349:1,At first it worked well for a month or so then the system board failed and I send it in to toshiba some complaints and three weeks later I then receive my laptop back only to discover that it still has the same problem so now I have to send it back again to get it fixed again.,SUPPORT#QUALITY,negative,QUALITY,SUPPORT
1769,349,349:2,This computer doesn't do that well with certain games it can't play some and it becomes too hot while playing games.,LAPTOP#MISCELLANEOUS,negative,MISCELLANEOUS,LAPTOP
1770,349,349:3,Oh and if thats not bad enough it doesn't come with a recovery cd so you can make one if you know how to or buy one if you buy it the cost is $25 for two cds.,LAPTOP#MISCELLANEOUS,negative,MISCELLANEOUS,LAPTOP
1771,349,349:4,the whole experiece is horrible so save up and buy a better laptop.,LAPTOP#GENERAL,negative,GENERAL,LAPTOP
1772,97,97:0,I bought a HP Pavilion DV4-1222nr laptop and have had so many problems with the computer.,LAPTOP#GENERAL,negative,GENERAL,LAPTOP
1773,97,97:1,"The computer is so slow, even after paying staples the extra money to speed it up.",LAPTOP#OPERATION_PERFORMANCE,negative,OPERATION_PERFORMANCE,LAPTOP
1774,97,97:2,They said it was a computer error on this type of computer.,LAPTOP#MISCELLANEOUS,negative,MISCELLANEOUS,LAPTOP
1775,97,97:3,"Also, I have alot of trouble with it getting very hot, and not even sitting on anything to make it hot.",LAPTOP#QUALITY,negative,QUALITY,LAPTOP
1776,97,97:4,"When the computer has been on for several minutes, it will occasionaly just go off by itself.",LAPTOP#OPERATION_PERFORMANCE,negative,OPERATION_PERFORMANCE,LAPTOP
1777,97,97:5,"Also, the battery does not last very long at all.",BATTERY#OPERATION_PERFORMANCE,negative,OPERATION_PERFORMANCE,BATTERY
1778,97,97:6,I would recommend not buying this product.,LAPTOP#GENERAL,negative,GENERAL,LAPTOP
1779,97,97:7,I have had no luck with staples or HP to resolve this problem.,SUPPORT#QUALITY,negative,QUALITY,SUPPORT
1780,97,97:8,I am stuck with a laptop that I cannot do very much with.,LAPTOP#GENERAL,negative,GENERAL,LAPTOP
1781,97,97:9,"Also, I have had alot of trouble with the keys sticking and will not type correctly.",KEYBOARD#OPERATION_PERFORMANCE,negative,OPERATION_PERFORMANCE,KEYBOARD
1782,97,97:10,"Also, I have had alot of trouble with the shift key to go to other lines.",KEYBOARD#OPERATION_PERFORMANCE,negative,OPERATION_PERFORMANCE,KEYBOARD
1783,97,97:11,"It gets stuck all of the time you use it, and you have to keep tapping on it to get it to work.",KEYBOARD#OPERATION_PERFORMANCE,negative,OPERATION_PERFORMANCE,KEYBOARD
1784,97,97:11,"It gets stuck all of the time you use it, and you have to keep tapping on it to get it to work.",KEYBOARD#USABILITY,negative,USABILITY,KEYBOARD
1785,97,97:12,Sometimes the screen even goes black on this computer.,DISPLAY#OPERATION_PERFORMANCE,negative,OPERATION_PERFORMANCE,DISPLAY
1786,97,97:13,Will probably never buy a HP again.,COMPANY#GENERAL,negative,GENERAL,COMPANY
1787,145,145:0,Purchased a Toshiba Lap top it worked good until just after the warrenty went out.,LAPTOP#QUALITY,neutral,QUALITY,LAPTOP
1788,145,145:0,Purchased a Toshiba Lap top it worked good until just after the warrenty went out.,LAPTOP#OPERATION_PERFORMANCE,neutral,OPERATION_PERFORMANCE,LAPTOP
1789,145,145:1,After the warrenty expired the hard drive went bad and it would have cost more to fix then to replace.,HARD_DISC#QUALITY,negative,QUALITY,HARD_DISC
1790,145,145:1,After the warrenty expired the hard drive went bad and it would have cost more to fix then to replace.,SUPPORT#PRICE,negative,PRICE,SUPPORT
1791,145,145:2,"Before we got this laptop, had a compaq pasaro for 5 years with no problems.",UNKNOWN#UNKNOWN,UNKNOWN,UNKNOWN,UNKNOWN
1792,145,145:3,After the bad experience with this computer went back to compaq.,UNKNOWN#UNKNOWN,UNKNOWN,UNKNOWN,UNKNOWN
1793,230,230:0,I hate it.,LAPTOP#GENERAL,negative,GENERAL,LAPTOP
1794,230,230:1,I have had the luxury (sarcasm) of owning 2 of these laptops.,LAPTOP#GENERAL,negative,GENERAL,LAPTOP
1795,230,230:2,The first fell apart right after the 1-year-warranty.,LAPTOP#QUALITY,negative,QUALITY,LAPTOP
1796,230,230:3,"During that time, I had to send it back 3 times.",LAPTOP#QUALITY,negative,QUALITY,LAPTOP
1797,230,230:4,I paid about 18000 for this laptop because of all the bells and whistles and it kept crapping out on me.,LAPTOP#DESIGN_FEATURES,negative,DESIGN_FEATURES,LAPTOP
1798,230,230:4,I paid about 18000 for this laptop because of all the bells and whistles and it kept crapping out on me.,LAPTOP#QUALITY,negative,QUALITY,LAPTOP
1799,230,230:4,I paid about 18000 for this laptop because of all the bells and whistles and it kept crapping out on me.,LAPTOP#PRICE,negative,PRICE,LAPTOP
1800,230,230:5,None of the techs at HP knew what they were doing.,SUPPORT#QUALITY,negative,QUALITY,SUPPORT
1801,230,230:6,"They would repair one thing, send it back and it would still have the same problem.",SUPPORT#QUALITY,negative,QUALITY,SUPPORT
1802,230,230:7,"The processor went on me, the fan went and the motherboard went.",CPU#QUALITY,negative,QUALITY,CPU
1803,230,230:7,"The processor went on me, the fan went and the motherboard went.",FANS_COOLING#QUALITY,negative,QUALITY,FANS_COOLING
1804,230,230:7,"The processor went on me, the fan went and the motherboard went.",MOTHERBOARD#QUALITY,negative,QUALITY,MOTHERBOARD
1805,230,230:8,"I wanted to purchase the extended warranty and they refused, because they knew it was trouble.",SUPPORT#QUALITY,negative,QUALITY,SUPPORT
1806,230,230:8,"I wanted to purchase the extended warranty and they refused, because they knew it was trouble.",LAPTOP#GENERAL,negative,GENERAL,LAPTOP
1807,230,230:9,I had something else go wrong and they said it had to be in good working order to be able to buy the warranty.,SUPPORT#QUALITY,negative,QUALITY,SUPPORT
1808,230,230:10,I took it to friend who temporarily fixed it and I finally paid about 1500 for the extended warranty.,WARRANTY#PRICE,neutral,PRICE,WARRANTY
1809,230,230:11,I sent it back AND THEY LOST IT.,SUPPORT#QUALITY,negative,QUALITY,SUPPORT
1810,230,230:12,I waited and waited and no laptop.,SUPPORT#QUALITY,negative,QUALITY,SUPPORT
1811,230,230:13,Finally after months of research the discovered that they mailed it to a Walmart and there probably would be no way to find the box.,SUPPORT#QUALITY,negative,QUALITY,SUPPORT
1812,230,230:14,"I waited another month for approval and for them to ""BUILD"" me a new laptop.",SUPPORT#QUALITY,negative,QUALITY,SUPPORT
1813,230,230:15,I was psyched.,UNKNOWN#UNKNOWN,UNKNOWN,UNKNOWN,UNKNOWN
1814,230,230:16,I thought all my problems would finally be solved being that my old computer wouldn't go onto our wireless network and I wouldn't have the same problems because it was updated.,LAPTOP#CONNECTIVITY,negative,CONNECTIVITY,LAPTOP
1815,230,230:17,Here we are another year later and the computer is doing the same thing.,SUPPORT#QUALITY,negative,QUALITY,SUPPORT
1816,230,230:18,HP didn't fix it.,SUPPORT#QUALITY,negative,QUALITY,SUPPORT
1817,230,230:19,I swear they design these things to go to crap after a year so you are stuck and have to buy a new one.,LAPTOP#QUALITY,negative,QUALITY,LAPTOP
1818,230,230:20,"I use my friends and family's $2000 laptops and they are fast and reliable and HP, well, I'll never buy or recommend an HP to anyone!",UNKNOWN#UNKNOWN,UNKNOWN,UNKNOWN,UNKNOWN
1819,130,130:0,bought notebook 07/2009.,UNKNOWN#UNKNOWN,UNKNOWN,UNKNOWN,UNKNOWN
1820,130,130:1,in 5 months the connect quality got worse and worse.,LAPTOP#CONNECTIVITY,negative,CONNECTIVITY,LAPTOP
1821,130,130:1,in 5 months the connect quality got worse and worse.,LAPTOP#QUALITY,negative,QUALITY,LAPTOP
1822,130,130:2,1st time they got it working the next 5 month they had me send it in.,SUPPORT#QUALITY,negative,QUALITY,SUPPORT
1823,130,130:3,returned it.,LAPTOP#GENERAL,negative,GENERAL,LAPTOP
1824,130,130:4,5 months dead again.,LAPTOP#QUALITY,negative,QUALITY,LAPTOP
1825,130,130:5,They say sorry out of warranty.,SUPPORT#QUALITY,negative,QUALITY,SUPPORT
1826,130,130:6,Summary: They played games with me for the warranty period.,SUPPORT#QUALITY,negative,QUALITY,SUPPORT
1827,130,130:7,Now 17 months later they want (would not say exact amount) $165.00 to $400 to fix the machine.,SUPPORT#PRICE,negative,PRICE,SUPPORT
1828,130,130:8,They had me send in the machine last April returned it to me in May with no documentation on what was done it anything.,SUPPORT#QUALITY,negative,QUALITY,SUPPORT
1829,130,130:9,Now the machine won't connect and Toshiba says that they did replace the connection card in May but they only warranty the repair for 30 days and now I'm out of warranty even though this has been a constant 5 month occurance since I bought the netbook.,LAPTOP#CONNECTIVITY,negative,CONNECTIVITY,LAPTOP
1830,130,130:9,Now the machine won't connect and Toshiba says that they did replace the connection card in May but they only warranty the repair for 30 days and now I'm out of warranty even though this has been a constant 5 month occurance since I bought the netbook.,SUPPORT#QUALITY,negative,QUALITY,SUPPORT
1831,130,130:10,So buyer beware when buying Toshiba,COMPANY#GENERAL,negative,GENERAL,COMPANY
1832,52,52:0,I bought this laptop the moment unibody product came to the market.,UNKNOWN#UNKNOWN,UNKNOWN,UNKNOWN,UNKNOWN
1833,52,52:1,"I also bought one for my wife, and 3 for my office.",UNKNOWN#UNKNOWN,UNKNOWN,UNKNOWN,UNKNOWN
1834,52,52:2,"They are wonderful, but very dangerous when it comes to emitting heat.",LAPTOP#GENERAL,positive,GENERAL,LAPTOP
1835,52,52:2,"They are wonderful, but very dangerous when it comes to emitting heat.",LAPTOP#QUALITY,negative,QUALITY,LAPTOP
1836,52,52:3,"I burned my leg, after lifting it from my desk, and for less than 5 second putting it on my lap to clean my coffee table, so I can place it there.",LAPTOP#QUALITY,negative,QUALITY,LAPTOP
1837,52,52:4,"I had to call Apple 19 times (each time 40 to 75 minutes on the phone), and take it to their store for evaluations, and diagnostics, 5 times.",SUPPORT#QUALITY,negative,QUALITY,SUPPORT
1838,52,52:5,"This is what they told me: It heats up, and that is the reason we no longer call them laptops, and simply categorize them as portables.",UNKNOWN#UNKNOWN,UNKNOWN,UNKNOWN,UNKNOWN
1839,52,52:6,"You might think, I am new in this game, but I am a gadget lover, and have had more than 2 dozens laptops in the past 15 years, and none gets this hot, that fast.",UNKNOWN#UNKNOWN,UNKNOWN,UNKNOWN,UNKNOWN
1840,52,52:7,I also experience the same with my MacBook Air.,UNKNOWN#UNKNOWN,UNKNOWN,UNKNOWN,UNKNOWN
1841,52,52:8,"So you might ask, what did Apple do for me?",UNKNOWN#UNKNOWN,UNKNOWN,UNKNOWN,UNKNOWN
1842,52,52:9,"For my burn thigh which has put a permanent mark on my skin (it happened 7 months ago) they offered me an ITouch 8Gig (you know it is a bit insulating when a company this rich, offer a loyal customer like me, a bottom of their product line as a gift for events like this).",COMPANY#GENERAL,negative,GENERAL,COMPANY
1843,52,52:10,"Steve Jobs, probably needs help and donations, and cannot afford a reasonable offers for people that truly are trying to support his baby.",COMPANY#GENERAL,negative,GENERAL,COMPANY
