,rid,sid,text,category,polarity,attribute,entity
587,40,40:9,"I did have to replace the battery once, but that was only a couple months ago and it's been working perfect ever since.",BATTERY#OPERATION_PERFORMANCE,positive,OPERATION_PERFORMANCE,BATTERY
588,40,40:10,"I would definitely reccomend this if you are in the market for an easy to use, stylish, fun, awesome computer.",LAPTOP#USABILITY,positive,USABILITY,LAPTOP
589,40,40:10,"I would definitely reccomend this if you are in the market for an easy to use, stylish, fun, awesome computer.",LAPTOP#DESIGN_FEATURES,positive,DESIGN_FEATURES,LAPTOP
590,40,40:10,"I would definitely reccomend this if you are in the market for an easy to use, stylish, fun, awesome computer.",LAPTOP#GENERAL,positive,GENERAL,LAPTOP
591,40,40:11,"Also it is very good for college students who just need a reliable, easy to use computer.",LAPTOP#MISCELLANEOUS,positive,MISCELLANEOUS,LAPTOP
592,40,40:11,"Also it is very good for college students who just need a reliable, easy to use computer.",LAPTOP#QUALITY,positive,QUALITY,LAPTOP
593,40,40:11,"Also it is very good for college students who just need a reliable, easy to use computer.",LAPTOP#USABILITY,positive,USABILITY,LAPTOP
594,40,40:12,Hope this helped!,UNKNOWN#UNKNOWN,UNKNOWN,UNKNOWN,UNKNOWN
595,394,394:0,"No laptop is perfect, but sometimes you just find a computer that works for you.",UNKNOWN#UNKNOWN,UNKNOWN,UNKNOWN,UNKNOWN
596,394,394:1,This laptop does everything I need it to very well.,LAPTOP#GENERAL,positive,GENERAL,LAPTOP
597,394,394:2,I bought this laptop so that the entire family had a computer in the living room;,UNKNOWN#UNKNOWN,UNKNOWN,UNKNOWN,UNKNOWN
598,394,394:3,the two of us use it regularly.,UNKNOWN#UNKNOWN,UNKNOWN,UNKNOWN,UNKNOWN
599,394,394:4,I wanted something that had a new Intel Core processors and HDMI port so that we could hook it up directly to our TV.,UNKNOWN#UNKNOWN,UNKNOWN,UNKNOWN,UNKNOWN
600,394,394:5,The best thing about this laptop is the price along with some of the newer features.,LAPTOP#PRICE,positive,PRICE,LAPTOP
601,394,394:5,The best thing about this laptop is the price along with some of the newer features.,LAPTOP#DESIGN_FEATURES,positive,DESIGN_FEATURES,LAPTOP
602,394,394:6,The screen is bright and the keyboard is nice;,DISPLAY#QUALITY,positive,QUALITY,DISPLAY
603,394,394:6,The screen is bright and the keyboard is nice;,KEYBOARD#GENERAL,positive,GENERAL,KEYBOARD
604,394,394:7,I find myself using the 10-key more than I thought I would.,KEYBOARD#DESIGN_FEATURES,positive,DESIGN_FEATURES,KEYBOARD
605,394,394:7,I find myself using the 10-key more than I thought I would.,KEYBOARD#USABILITY,positive,USABILITY,KEYBOARD
606,394,394:8,Battery is lasting about 6 hours as I am surfing the web on Sundays while checking football scores and watching funny Youtube videos.,BATTERY#OPERATION_PERFORMANCE,neutral,OPERATION_PERFORMANCE,BATTERY
607,394,394:9,For those that care about noise this thing doesn't really make any;,LAPTOP#QUALITY,positive,QUALITY,LAPTOP
608,394,394:10,the i3 processor doesn't seem to run hot and the fan rarely turns on.,CPU#QUALITY,positive,QUALITY,CPU
609,394,394:11,I took off a star because the machine has a lot of junk software on it.,LAPTOP#DESIGN_FEATURES,negative,DESIGN_FEATURES,LAPTOP
610,394,394:11,I took off a star because the machine has a lot of junk software on it.,SOFTWARE#GENERAL,negative,GENERAL,SOFTWARE
611,394,394:12,I wish Toshiba would allow their customers to select an option that only boots the OS at setup and removes all the unnecessary stuff.,LAPTOP#DESIGN_FEATURES,negative,DESIGN_FEATURES,LAPTOP
612,394,394:13,Once I removed all the software the laptop loads in 15-20 seconds.,SOFTWARE#GENERAL,negative,GENERAL,SOFTWARE
613,394,394:13,Once I removed all the software the laptop loads in 15-20 seconds.,LAPTOP#OPERATION_PERFORMANCE,neutral,OPERATION_PERFORMANCE,LAPTOP
614,394,394:14,This is not a serious gaming laptop or a serious media machine;,LAPTOP#MISCELLANEOUS,negative,MISCELLANEOUS,LAPTOP
615,394,394:15,my niece and nephew have played a few web games and it runs anything that doesn't require a dedicated video card.,LAPTOP#MISCELLANEOUS,neutral,MISCELLANEOUS,LAPTOP
616,394,394:15,my niece and nephew have played a few web games and it runs anything that doesn't require a dedicated video card.,GRAPHICS#DESIGN_FEATURES,neutral,DESIGN_FEATURES,GRAPHICS
617,394,394:16,Overall I am very satisfied with the purchase.,LAPTOP#GENERAL,positive,GENERAL,LAPTOP
618,394,394:17,I looked around and based off my price/features comparison from a brand I trusted I landed here.,UNKNOWN#UNKNOWN,UNKNOWN,UNKNOWN,UNKNOWN
619,386,386:0,"Great, quick laptop for the money.",LAPTOP#GENERAL,positive,GENERAL,LAPTOP
620,386,386:0,"Great, quick laptop for the money.",LAPTOP#PRICE,neutral,PRICE,LAPTOP
621,386,386:0,"Great, quick laptop for the money.",LAPTOP#OPERATION_PERFORMANCE,positive,OPERATION_PERFORMANCE,LAPTOP
622,386,386:1,Right size and weight for portability.,LAPTOP#DESIGN_FEATURES,positive,DESIGN_FEATURES,LAPTOP
623,386,386:1,Right size and weight for portability.,LAPTOP#PORTABILITY,positive,PORTABILITY,LAPTOP
624,386,386:2,Battery life needs more life.,BATTERY#OPERATION_PERFORMANCE,negative,OPERATION_PERFORMANCE,BATTERY
625,386,386:3,Battery is not upgradable to a longer life battery.,LAPTOP#USABILITY,negative,USABILITY,LAPTOP
626,381,381:0,Both my husband and I have this model Toshiba.,UNKNOWN#UNKNOWN,UNKNOWN,UNKNOWN,UNKNOWN
627,381,381:1,I love everything about it.,LAPTOP#GENERAL,positive,GENERAL,LAPTOP
628,381,381:2,The only downfall is the battery only last 1.5-2.0 hrs when not plugged in.,BATTERY#OPERATION_PERFORMANCE,negative,OPERATION_PERFORMANCE,BATTERY
629,381,381:3,I would like at least a 4 hr. battery life.,BATTERY#OPERATION_PERFORMANCE,negative,OPERATION_PERFORMANCE,BATTERY
630,381,381:4,"Otherwise, all other features are a 1",LAPTOP#DESIGN_FEATURES,positive,DESIGN_FEATURES,LAPTOP
631,174,174:0,This mac is great!,LAPTOP#GENERAL,positive,GENERAL,LAPTOP
632,174,174:1,"lightweight, long battery life, excellent transition from PC;",LAPTOP#DESIGN_FEATURES,positive,DESIGN_FEATURES,LAPTOP
633,174,174:1,"lightweight, long battery life, excellent transition from PC;",BATTERY#OPERATION_PERFORMANCE,positive,OPERATION_PERFORMANCE,BATTERY
634,174,174:1,"lightweight, long battery life, excellent transition from PC;",LAPTOP#MISCELLANEOUS,positive,MISCELLANEOUS,LAPTOP
635,211,211:0,THIS HAS BEEN NOTHING BUT A HEADACHE SINCE WE PURCHASED IT.,LAPTOP#QUALITY,negative,QUALITY,LAPTOP
636,211,211:1,"I will NEVER buy (Refurbished) again, I don't cae how cheap it is.",LAPTOP#MISCELLANEOUS,negative,MISCELLANEOUS,LAPTOP
637,211,211:2,I'll wait and save up for a new one.,UNKNOWN#UNKNOWN,UNKNOWN,UNKNOWN,UNKNOWN
638,211,211:3,Just don't waste your time and money on this.,LAPTOP#GENERAL,negative,GENERAL,LAPTOP
639,211,211:4,"I tried giving it 0 stars but I had to choose at least one, but IMO NO STARS",LAPTOP#GENERAL,negative,GENERAL,LAPTOP
640,131,131:0,Summary: Dont buy HP.,COMPANY#GENERAL,negative,GENERAL,COMPANY
641,131,131:1,"If you buy, pray you dont have major prolems.",COMPANY#GENERAL,negative,GENERAL,COMPANY
642,143,143:0,Runs Hot,LAPTOP#QUALITY,negative,QUALITY,LAPTOP
643,143,143:1,I thought we were paying for quality in our decision to buy an Apple product.,COMPANY#GENERAL,negative,GENERAL,COMPANY
644,143,143:1,I thought we were paying for quality in our decision to buy an Apple product.,LAPTOP#QUALITY,negative,QUALITY,LAPTOP
645,143,143:2,"Unfortunately, that is not the case.",UNKNOWN#UNKNOWN,UNKNOWN,UNKNOWN,UNKNOWN
646,143,143:3,"After a little more than a year of owning my MacBook Pro, the monitor has completely died.",DISPLAY#QUALITY,negative,QUALITY,DISPLAY
647,143,143:4,"Because we did not purchase the extended warranty in time, we are on the hook for the repair.",UNKNOWN#UNKNOWN,UNKNOWN,UNKNOWN,UNKNOWN
648,143,143:5,The Genius at the Apple store advised me that there was nothing about my use of the computer that caused this failure.,UNKNOWN#UNKNOWN,UNKNOWN,UNKNOWN,UNKNOWN
649,143,143:6,"In fact, he said, about 10% of their products fail.",UNKNOWN#UNKNOWN,UNKNOWN,UNKNOWN,UNKNOWN
650,143,143:7,Hmmm - that high failure rate sure isn't reflected in the retail price.,UNKNOWN#UNKNOWN,UNKNOWN,UNKNOWN,UNKNOWN
651,162,162:0,"This purchase opened me to the world of Macbooks, and I am impressed with the intuition of the design, the beauty of the product, and the excellent technological advances associated with it.",LAPTOP#DESIGN_FEATURES,positive,DESIGN_FEATURES,LAPTOP
652,204,204:0,This is the third MacBook Pro in our family.,UNKNOWN#UNKNOWN,UNKNOWN,UNKNOWN,UNKNOWN
653,204,204:1,I bought my first MacBook after seeing the product demonstrated.,UNKNOWN#UNKNOWN,UNKNOWN,UNKNOWN,UNKNOWN
654,204,204:2,Then 2 of my nephews were going into music and both fell in love with the MacBook Pro.,LAPTOP#GENERAL,positive,GENERAL,LAPTOP
655,204,204:3,Now they are believers in the product.,LAPTOP#GENERAL,positive,GENERAL,LAPTOP
656,204,204:4,"It is easy to use, has great screen quality, and every so light weight.",LAPTOP#USABILITY,positive,USABILITY,LAPTOP
657,204,204:4,"It is easy to use, has great screen quality, and every so light weight.",DISPLAY#QUALITY,positive,QUALITY,DISPLAY
658,204,204:4,"It is easy to use, has great screen quality, and every so light weight.",LAPTOP#DESIGN_FEATURES,positive,DESIGN_FEATURES,LAPTOP
659,204,204:5,I own other Macs but always find myself navigation to the MacBook Pro to get my work done.,UNKNOWN#UNKNOWN,UNKNOWN,UNKNOWN,UNKNOWN
660,207,207:0,This little netboook is helping me get work done!,LAPTOP#GENERAL,positive,GENERAL,LAPTOP
661,207,207:1,I can do pretty much 75% of what I do on my desktop on my kitchen table.,UNKNOWN#UNKNOWN,UNKNOWN,UNKNOWN,UNKNOWN
662,207,207:2,I homeschool my kids and with this netbook next to my desk we get to teaching and illustrating without skipping a beat.,LAPTOP#MISCELLANEOUS,positive,MISCELLANEOUS,LAPTOP
663,236,236:0,I am first time Mac Buyer and am amazed at features and ease of use the Mac offers.,LAPTOP#DESIGN_FEATURES,positive,DESIGN_FEATURES,LAPTOP
664,236,236:0,I am first time Mac Buyer and am amazed at features and ease of use the Mac offers.,LAPTOP#USABILITY,positive,USABILITY,LAPTOP
665,286,286:0,"I bought it for my mom and she reports that the battery life lasts all day for her, it's very lightweight, and the response for the computing she's doing (Internet focused activity: mail, research, etc.) is excellent;",BATTERY#OPERATION_PERFORMANCE,positive,OPERATION_PERFORMANCE,BATTERY
666,286,286:0,"I bought it for my mom and she reports that the battery life lasts all day for her, it's very lightweight, and the response for the computing she's doing (Internet focused activity: mail, research, etc.) is excellent;",LAPTOP#DESIGN_FEATURES,positive,DESIGN_FEATURES,LAPTOP
667,286,286:0,"I bought it for my mom and she reports that the battery life lasts all day for her, it's very lightweight, and the response for the computing she's doing (Internet focused activity: mail, research, etc.) is excellent;",LAPTOP#OPERATION_PERFORMANCE,positive,OPERATION_PERFORMANCE,LAPTOP
668,286,286:0,"I bought it for my mom and she reports that the battery life lasts all day for her, it's very lightweight, and the response for the computing she's doing (Internet focused activity: mail, research, etc.) is excellent;",LAPTOP#MISCELLANEOUS,positive,MISCELLANEOUS,LAPTOP
669,286,286:1,she can't tell the difference between it and her regular desktop system.,UNKNOWN#UNKNOWN,UNKNOWN,UNKNOWN,UNKNOWN
670,286,286:2,The overall build quality of the unit is excellent and she'd recommend it to anyone else looking for a netbook.,LAPTOP#QUALITY,positive,QUALITY,LAPTOP
671,286,286:2,The overall build quality of the unit is excellent and she'd recommend it to anyone else looking for a netbook.,LAPTOP#GENERAL,positive,GENERAL,LAPTOP
672,286,286:3,"If you're looking for something to fly through those massive spreadsheets or play a graphics-intensive game, you'd be better off getting a machine aimed at that segment of the market.",LAPTOP#MISCELLANEOUS,neutral,MISCELLANEOUS,LAPTOP
673,280,280:0,"previous laptops were pc's, still have them, but the mac osx is a clean and smooth operating system.",OS#DESIGN_FEATURES,positive,DESIGN_FEATURES,OS
674,280,280:0,"previous laptops were pc's, still have them, but the mac osx is a clean and smooth operating system.",OS#OPERATION_PERFORMANCE,positive,OPERATION_PERFORMANCE,OS
675,280,280:1,"still testing the battery life as i thought it would be better, but am very happy with the upgrade.",BATTERY#OPERATION_PERFORMANCE,neutral,OPERATION_PERFORMANCE,BATTERY
676,280,280:1,"still testing the battery life as i thought it would be better, but am very happy with the upgrade.",LAPTOP#GENERAL,positive,GENERAL,LAPTOP
677,281,281:0,"Probably as good as you can get in a netbook, does everything I ask for and has some very good unexpected pluses.",LAPTOP#GENERAL,positive,GENERAL,LAPTOP
678,281,281:0,"Probably as good as you can get in a netbook, does everything I ask for and has some very good unexpected pluses.",LAPTOP#DESIGN_FEATURES,positive,DESIGN_FEATURES,LAPTOP
679,281,281:1,Has met or exceeded my needs for a compact travel device.,LAPTOP#PORTABILITY,positive,PORTABILITY,LAPTOP
680,281,281:1,Has met or exceeded my needs for a compact travel device.,LAPTOP#USABILITY,positive,USABILITY,LAPTOP
681,282,282:0,"So far, so good!",LAPTOP#GENERAL,positive,GENERAL,LAPTOP
682,282,282:1,I've been impressed with the battery life and the performance for such a small amount of memory.,BATTERY#OPERATION_PERFORMANCE,positive,OPERATION_PERFORMANCE,BATTERY
683,282,282:1,I've been impressed with the battery life and the performance for such a small amount of memory.,LAPTOP#OPERATION_PERFORMANCE,positive,OPERATION_PERFORMANCE,LAPTOP
684,282,282:1,I've been impressed with the battery life and the performance for such a small amount of memory.,MEMORY#DESIGN_FEATURES,neutral,DESIGN_FEATURES,MEMORY
685,282,282:2,I don't understand why only Windows 7 Starter is included.,LAPTOP#DESIGN_FEATURES,negative,DESIGN_FEATURES,LAPTOP
686,179,179:0,Strong performance in this device makes use of fun and a strong sense of the era of speed,LAPTOP#OPERATION_PERFORMANCE,positive,OPERATION_PERFORMANCE,LAPTOP
687,179,179:1,This device serves all modern requirements is a very strong game and is very useful for designers.,LAPTOP#GENERAL,positive,GENERAL,LAPTOP
688,179,179:1,This device serves all modern requirements is a very strong game and is very useful for designers.,LAPTOP#MISCELLANEOUS,positive,MISCELLANEOUS,LAPTOP
689,179,179:2,Enjoy that Toshib force and durability unparalleled,LAPTOP#OPERATION_PERFORMANCE,positive,OPERATION_PERFORMANCE,LAPTOP
690,179,179:2,Enjoy that Toshib force and durability unparalleled,LAPTOP#QUALITY,positive,QUALITY,LAPTOP
691,336,336:0,"Needs longer lasting battery, More than 1 to 2 Hrs.",BATTERY#OPERATION_PERFORMANCE,negative,OPERATION_PERFORMANCE,BATTERY
692,336,336:1,"Needs Power and Mouse Cable to Plug in back instead of side, In the way of operating a mouse in small area.",MOUSE#OPERATION_PERFORMANCE,neutral,OPERATION_PERFORMANCE,MOUSE
693,336,336:1,"Needs Power and Mouse Cable to Plug in back instead of side, In the way of operating a mouse in small area.",MOUSE#DESIGN_FEATURES,negative,DESIGN_FEATURES,MOUSE
694,336,336:2,For the use it was purchased for it is a good Laptop.,LAPTOP#MISCELLANEOUS,positive,MISCELLANEOUS,LAPTOP
695,336,336:3,Comfterbale to use light easy to transport.,LAPTOP#USABILITY,positive,USABILITY,LAPTOP
696,336,336:3,Comfterbale to use light easy to transport.,LAPTOP#DESIGN_FEATURES,positive,DESIGN_FEATURES,LAPTOP
697,336,336:3,Comfterbale to use light easy to transport.,LAPTOP#PORTABILITY,positive,PORTABILITY,LAPTOP
698,337,337:0,"I love this product because it is Toshiba and its 15.6"".",LAPTOP#GENERAL,positive,GENERAL,LAPTOP
699,337,337:0,"I love this product because it is Toshiba and its 15.6"".",LAPTOP#DESIGN_FEATURES,positive,DESIGN_FEATURES,LAPTOP
700,337,337:0,"I love this product because it is Toshiba and its 15.6"".",COMPANY#GENERAL,positive,GENERAL,COMPANY
701,337,337:1,"It has no camera but, I can always buy and install one easy.",LAPTOP#DESIGN_FEATURES,neutral,DESIGN_FEATURES,LAPTOP
702,337,337:2,"I had a USB connect but, i can't use it because it is not compatible.",LAPTOP#USABILITY,negative,USABILITY,LAPTOP
703,337,337:3,That's the downside for me.,LAPTOP#USABILITY,negative,USABILITY,LAPTOP
704,337,337:4,"But, I would recommend this product.",LAPTOP#GENERAL,positive,GENERAL,LAPTOP
705,340,340:0,Satisfy what I paid for it.,LAPTOP#GENERAL,positive,GENERAL,LAPTOP
706,340,340:0,Satisfy what I paid for it.,LAPTOP#PRICE,neutral,PRICE,LAPTOP
707,340,340:1,Good monitor and performed well.,DISPLAY#GENERAL,positive,GENERAL,DISPLAY
708,340,340:1,Good monitor and performed well.,LAPTOP#OPERATION_PERFORMANCE,positive,OPERATION_PERFORMANCE,LAPTOP
709,340,340:2,I am using the external speaker- sound is good.,MULTIMEDIA_DEVICES#QUALITY,positive,QUALITY,MULTIMEDIA_DEVICES
710,340,340:3,Best thing is I can use existing 32 bit old programs.,LAPTOP#USABILITY,positive,USABILITY,LAPTOP
711,340,340:4,I recommend for word processing and internet users.,LAPTOP#MISCELLANEOUS,positive,MISCELLANEOUS,LAPTOP
712,365,365:0,The Toshiba laptop I am using is easier to use than most I have tried.,UNKNOWN#UNKNOWN,UNKNOWN,UNKNOWN,UNKNOWN
713,365,365:1,The games included are very good games.,SOFTWARE#GENERAL,positive,GENERAL,SOFTWARE
714,365,365:2,I am finding my way around this laptop better than my last one.,UNKNOWN#UNKNOWN,UNKNOWN,UNKNOWN,UNKNOWN
715,365,365:3,I would highly recommend this one to my friends,LAPTOP#GENERAL,positive,GENERAL,LAPTOP
716,358,358:0,I bought this laptop because of the performance to price ratio.,LAPTOP#OPERATION_PERFORMANCE,positive,OPERATION_PERFORMANCE,LAPTOP
717,358,358:0,I bought this laptop because of the performance to price ratio.,LAPTOP#PRICE,positive,PRICE,LAPTOP
718,358,358:1,"It works great for general internet use, Microsoft Office apps, home bookkeeping, etc.",LAPTOP#MISCELLANEOUS,positive,MISCELLANEOUS,LAPTOP
719,358,358:2,"It doesn't have a lot of frills, but I didn't need any, and being able to buy what I needed, and not more than I needed was very important.",LAPTOP#DESIGN_FEATURES,neutral,DESIGN_FEATURES,LAPTOP
720,358,358:2,"It doesn't have a lot of frills, but I didn't need any, and being able to buy what I needed, and not more than I needed was very important.",LAPTOP#MISCELLANEOUS,positive,MISCELLANEOUS,LAPTOP
721,355,355:0,This computer I used daily nice compact design.,LAPTOP#DESIGN_FEATURES,positive,DESIGN_FEATURES,LAPTOP
722,355,355:0,This computer I used daily nice compact design.,LAPTOP#USABILITY,positive,USABILITY,LAPTOP
723,355,355:1,Excellent speed for processing data.,LAPTOP#OPERATION_PERFORMANCE,positive,OPERATION_PERFORMANCE,LAPTOP
724,355,355:2,And if you are a game player it works with World Of Warcraft wonderfully.,LAPTOP#MISCELLANEOUS,positive,MISCELLANEOUS,LAPTOP
725,355,355:3,Now when I order I did not go full scale for the webcam or full keyboard I wanted something for basics of being easy to carry when I use crutchs or wheelchair and with a backpack laptop bag.,UNKNOWN#UNKNOWN,UNKNOWN,UNKNOWN,UNKNOWN
726,355,355:4,All in all great item highly recommend it.,LAPTOP#GENERAL,positive,GENERAL,LAPTOP
727,353,353:0,Bought it to use mostly for oline classes.,UNKNOWN#UNKNOWN,UNKNOWN,UNKNOWN,UNKNOWN
728,353,353:1,i would have to say that overall its great!,LAPTOP#GENERAL,positive,GENERAL,LAPTOP
729,353,353:2,"Aside from the trial software and the short battery life, lack of a webcam, its great.",SOFTWARE#MISCELLANEOUS,negative,MISCELLANEOUS,SOFTWARE
730,353,353:2,"Aside from the trial software and the short battery life, lack of a webcam, its great.",BATTERY#OPERATION_PERFORMANCE,negative,OPERATION_PERFORMANCE,BATTERY
731,353,353:2,"Aside from the trial software and the short battery life, lack of a webcam, its great.",LAPTOP#DESIGN_FEATURES,negative,DESIGN_FEATURES,LAPTOP
732,353,353:2,"Aside from the trial software and the short battery life, lack of a webcam, its great.",LAPTOP#GENERAL,positive,GENERAL,LAPTOP
733,353,353:3,"Fast, great visual!",LAPTOP#OPERATION_PERFORMANCE,positive,OPERATION_PERFORMANCE,LAPTOP
734,353,353:3,"Fast, great visual!",DISPLAY#QUALITY,positive,QUALITY,DISPLAY
735,353,353:4,"Oh yea, has no numeric pad on the side.",KEYBOARD#DESIGN_FEATURES,negative,DESIGN_FEATURES,KEYBOARD
736,353,353:5,"I use that alot on my desktop, so I am adjusting to not having it.",UNKNOWN#UNKNOWN,UNKNOWN,UNKNOWN,UNKNOWN
737,295,295:0,2nd Best computer in the world  only one way this computer might become the best is that it needs to upgreade patches  to make less easier for people to hack into,LAPTOP#GENERAL,positive,GENERAL,LAPTOP
738,295,295:0,2nd Best computer in the world  only one way this computer might become the best is that it needs to upgreade patches  to make less easier for people to hack into,LAPTOP#QUALITY,neutral,QUALITY,LAPTOP
739,344,344:0,Sells for the same as a netbook without sacrificing size.,UNKNOWN#UNKNOWN,UNKNOWN,UNKNOWN,UNKNOWN
740,344,344:1,My favorite part of this computer is that it has a vga port so I can connect it to a bigger screen.,LAPTOP#DESIGN_FEATURES,neutral,DESIGN_FEATURES,LAPTOP
741,344,344:1,My favorite part of this computer is that it has a vga port so I can connect it to a bigger screen.,LAPTOP#CONNECTIVITY,positive,CONNECTIVITY,LAPTOP
742,344,344:2,Great wifi too.,LAPTOP#CONNECTIVITY,positive,CONNECTIVITY,LAPTOP
743,344,344:3,"The screen is a little glary, and I hated the clicking buttons, but I got used to them.",DISPLAY#QUALITY,negative,QUALITY,DISPLAY
744,344,344:3,"The screen is a little glary, and I hated the clicking buttons, but I got used to them.",MOUSE#USABILITY,neutral,USABILITY,MOUSE
745,345,345:0,Overall for the money this is a good deal.,LAPTOP#GENERAL,positive,GENERAL,LAPTOP
746,345,345:0,Overall for the money this is a good deal.,LAPTOP#PRICE,neutral,PRICE,LAPTOP
747,345,345:1,There is no number pad to the right of the keyboard which is a bummer.,KEYBOARD#DESIGN_FEATURES,negative,DESIGN_FEATURES,KEYBOARD
748,345,345:2,The speakers are terrible and are probably the cheapest ones I have ever seen in a laptop so if your planning to listen to music I suggest you get something better.,MULTIMEDIA_DEVICES#GENERAL,negative,GENERAL,MULTIMEDIA_DEVICES
749,345,345:2,The speakers are terrible and are probably the cheapest ones I have ever seen in a laptop so if your planning to listen to music I suggest you get something better.,MULTIMEDIA_DEVICES#QUALITY,negative,QUALITY,MULTIMEDIA_DEVICES
750,345,345:3,"while the keyboard itself is alright, the plate around it is cheap plastic and makes a hollow sound when using the mouse command buttons.",KEYBOARD#GENERAL,neutral,GENERAL,KEYBOARD
751,345,345:3,"while the keyboard itself is alright, the plate around it is cheap plastic and makes a hollow sound when using the mouse command buttons.",LAPTOP#QUALITY,negative,QUALITY,LAPTOP
752,341,341:0,"I am overall very pleased with my toshiba satellite, I like the extra features, I love the windows 7 home premium.",LAPTOP#GENERAL,positive,GENERAL,LAPTOP
753,341,341:0,"I am overall very pleased with my toshiba satellite, I like the extra features, I love the windows 7 home premium.",LAPTOP#DESIGN_FEATURES,positive,DESIGN_FEATURES,LAPTOP
754,341,341:0,"I am overall very pleased with my toshiba satellite, I like the extra features, I love the windows 7 home premium.",OS#GENERAL,positive,GENERAL,OS
755,341,341:1,"The battery life has not decreased since I bought it, so i'm thrilled with that.",BATTERY#OPERATION_PERFORMANCE,positive,OPERATION_PERFORMANCE,BATTERY
756,341,341:1,"The battery life has not decreased since I bought it, so i'm thrilled with that.",BATTERY#QUALITY,positive,QUALITY,BATTERY
757,341,341:2,"I also love the design, the looks, the feel, and the my toshiba feature is wonderfull.",LAPTOP#DESIGN_FEATURES,positive,DESIGN_FEATURES,LAPTOP
758,341,341:2,"I also love the design, the looks, the feel, and the my toshiba feature is wonderfull.",LAPTOP#QUALITY,positive,QUALITY,LAPTOP
759,341,341:3,I would easly reccomend this laptop to a friend.,LAPTOP#GENERAL,positive,GENERAL,LAPTOP
760,334,334:0,Couldnt not use it.,LAPTOP#USABILITY,negative,USABILITY,LAPTOP
761,334,334:1,Tried to make a recovey disk wouldnt get passed the first recovery disk.,LAPTOP#USABILITY,negative,USABILITY,LAPTOP
762,334,334:2,defective software.,SOFTWARE#QUALITY,negative,QUALITY,SOFTWARE
763,334,334:3,returned it to walmart.,LAPTOP#GENERAL,negative,GENERAL,LAPTOP
764,334,334:4,This was the second computer and brand bought that day.,UNKNOWN#UNKNOWN,UNKNOWN,UNKNOWN,UNKNOWN
765,327,327:0,I would like to have volume buttons rather than the adjustment that is on the front.,LAPTOP#DESIGN_FEATURES,negative,DESIGN_FEATURES,LAPTOP
766,327,327:1,I also had a problem with the touchpad that caused the mouse pointer to jump all over the screen.,MOUSE#OPERATION_PERFORMANCE,negative,OPERATION_PERFORMANCE,MOUSE
767,327,327:2,I went to Toshiba online help and found some suggestions to fix it.,SUPPORT#QUALITY,positive,QUALITY,SUPPORT
768,327,327:3,One of them seems to have worked.,SUPPORT#QUALITY,positive,QUALITY,SUPPORT
769,329,329:0,Its a good laptop for its value.,LAPTOP#GENERAL,positive,GENERAL,LAPTOP
770,329,329:0,Its a good laptop for its value.,LAPTOP#PRICE,neutral,PRICE,LAPTOP
771,329,329:1,Registration/1st use is easy.,LAPTOP#USABILITY,positive,USABILITY,LAPTOP
772,329,329:2,Features like the font are very block-like and old school.,LAPTOP#DESIGN_FEATURES,negative,DESIGN_FEATURES,LAPTOP
773,329,329:3,"Would like more trendy, high tech features.",LAPTOP#DESIGN_FEATURES,negative,DESIGN_FEATURES,LAPTOP
774,329,329:4,The start menu is not the easiest thing to navigate due to the stacking.,OS#USABILITY,negative,USABILITY,OS
